<?xml version="1.0" encoding="UTF-8"?>
<contextCollection xmlns="http://schemas.heron-mc.org/hmc/1.0"
                   xmlns:xsi="http://www.w3.org/2001/XMLSchema-instance"
                   xsi:schemaLocation="http://schemas.heron-mc.org/hmc/1.0 http://schemas.heron-mc.org/hmc/1.0/heron-map-context.xsd">

    <title>Thematische PDOK configuratie - Deze configuratie bevat alle services geordend per thema</title>
    <baseUrl>http://test.geodata.nationaalgeoregister.nl/</baseUrl>
    <projection>EPSG:28992</projection>
    <units>m</units>
    <resolutions>3440.640,1720.320, 860.160, 430.080, 215.040, 107.520, 53.760, 26.880, 13.440, 6.720, 3.360, 1.680,
        0.840, 0.420, 0.210, 0.105, 0.0525
    </resolutions>
    <maxExtent>-285401.920,22598.080,595401.920,903401.920</maxExtent>
    <center>155000,463000</center>
    <xyPrecision>3</xyPrecision>
    <zoom>2</zoom>
    <allOverlays>true</allOverlays>

    <context>
        <url>include/achtergrond</url>
    </context>

    <contextFolder>
        <isExpanded>true</isExpanded>
        <title>Adminstratieve eenheden</title>
        <context>
            <url>include/bestuurlijkegrenzen</url>
        </context>
        <context>
            <url>include/wijkenenbuurten</url>
        </context>
    </contextFolder>

    <contextFolder>
        <isExpanded>true</isExpanded>
        <title>Statistiek</title>
        <context>
            <url>include/cbsvierkanten</url>
        </context>
    </contextFolder>

</contextCollection>
