<contextCollection xmlns="http://schemas.heron-mc.org/hmc/1.0"
	xmlns:xsi="http://www.w3.org/2001/XMLSchema-instance"
	xsi:schemaLocation="http://schemas.heron-mc.org/hmc/1.0 http://schemas.heron-mc.org/hmc/1.0/heron-map-context.xsd">
		<context>
			<title>Bodemgebruik 2008</title>
			<wmsLayer>
				<title>BBG eenheden [wms]</title>
				<url>{baseUrl}bestandbodemgebruik2008/wms?</url>
				<isBaseLayer>false</isBaseLayer>
				<opacity>0.7</opacity>
				<isTransparent>true</isTransparent>
				<isVisible>false</isVisible>
				<maxResolution>26.88</maxResolution>
				<layers>bbg2008</layers>
				<format>image/png</format>
				<featureInfoFormat>application/vnd.ogc.gml</featureInfoFormat>
				<isAlpha>true</isAlpha>
				<isSingleTile>true</isSingleTile>
			</wmsLayer>
			<wmsLayer>
				<title>BBG hoofdgroep [wms]</title>
				<url>{baseUrl}bestandbodemgebruik2008/wms?</url>
				<isBaseLayer>false</isBaseLayer>
				<opacity>0.7</opacity>
				<isTransparent>true</isTransparent>
				<isVisible>false</isVisible>
				<minResolution>53.76</minResolution>
				<layers>bbg2008_hoofdgroep</layers>
				<format>image/png</format>
				<featureInfoFormat>application/vnd.ogc.gml</featureInfoFormat>
				<isAlpha>true</isAlpha>
				<isSingleTile>true</isSingleTile>
			</wmsLayer>
		</context>
</contextCollection>