<contextCollection xmlns="http://schemas.heron-mc.org/hmc/1.0"
	xmlns:xsi="http://www.w3.org/2001/XMLSchema-instance"
	xsi:schemaLocation="http://schemas.heron-mc.org/hmc/1.0 http://schemas.heron-mc.org/hmc/1.0/heron-map-context.xsd">
		<context>
			<title>Bevolkingskernen 2008</title>
			<wmsLayer>
				<title>Naamgeving kernen [wms]</title>
				<url>{baseUrl}bevolkingskernen2008/wms?</url>
				<isBaseLayer>false</isBaseLayer>
				<opacity>0.7</opacity>
				<isTransparent>true</isTransparent>
				<isVisible>false</isVisible>
				<maxResolution>53.76</maxResolution>
				<layers>naamgeving_kernen_alles</layers>
				<format>image/png</format>
				<featureInfoFormat>application/vnd.ogc.gml</featureInfoFormat>
				<isAlpha>true</isAlpha>
				<isSingleTile>true</isSingleTile>
			</wmsLayer>
			<wmsLayer>
				<title>Naamgeving kernen 40k+ [wms]</title>
				<url>{baseUrl}bevolkingskernen2008/wms?</url>
				<isBaseLayer>false</isBaseLayer>
				<opacity>0.7</opacity>
				<isTransparent>true</isTransparent>
				<isVisible>false</isVisible>
				<minResolution>107.52</minResolution>
				<maxResolution>860.16</maxResolution>
				<layers>naamgeving_kernen_40k_plus</layers>
				<format>image/png</format>
				<featureInfoFormat>application/vnd.ogc.gml</featureInfoFormat>
				<isAlpha>true</isAlpha>
				<isSingleTile>true</isSingleTile>
			</wmsLayer>
			<wmsLayer>
				<title>Gemeentegrens generalisatie [wms]</title>
				<url>{baseUrl}bevolkingskernen2008/wms?</url>
				<isBaseLayer>false</isBaseLayer>
				<opacity>0.7</opacity>
				<isTransparent>true</isTransparent>
				<isVisible>false</isVisible>
				<layers>gemeentegrens_generalisatie_2008</layers>
				<format>image/png</format>
				<featureInfoFormat>application/vnd.ogc.gml</featureInfoFormat>
				<isAlpha>true</isAlpha>
				<isSingleTile>true</isSingleTile>
			</wmsLayer>
			<wmsLayer>
				<title>Provinciegrens generalisatie [wms]</title>
				<url>{baseUrl}bevolkingskernen2008/wms?</url>
				<isBaseLayer>false</isBaseLayer>
				<opacity>0.7</opacity>
				<isTransparent>true</isTransparent>
				<isVisible>false</isVisible>
				<layers>provgrens_generalisatie_2008</layers>
				<format>image/png</format>
				<featureInfoFormat>application/vnd.ogc.gml</featureInfoFormat>
				<isAlpha>true</isAlpha>
				<isSingleTile>true</isSingleTile>
			</wmsLayer>
			<wmsLayer>
				<title>CBS bevolkingskernen [wms]</title>
				<url>{baseUrl}bevolkingskernen2008/wms?</url>
				<isBaseLayer>false</isBaseLayer>
				<opacity>0.7</opacity>
				<isTransparent>true</isTransparent>
				<isVisible>false</isVisible>
				<layers>cbsbevolkingskernen2008</layers>
				<format>image/png</format>
				<featureInfoFormat>application/vnd.ogc.gml</featureInfoFormat>
				<isAlpha>true</isAlpha>
				<isSingleTile>true</isSingleTile>
			</wmsLayer>
		</context>
</contextCollection>