<contextCollection xmlns="http://schemas.heron-mc.org/hmc/1.0"
	xmlns:xsi="http://www.w3.org/2001/XMLSchema-instance"
	xsi:schemaLocation="http://schemas.heron-mc.org/hmc/1.0 http://schemas.heron-mc.org/hmc/1.0/heron-map-context.xsd">
	<context>
		<title>Top50NL Raster</title>
		<wmsLayer>
			<title>Top50NL Raster [wms]</title>
			<url>{baseUrl}top50raster/wms?</url>
			<isBaseLayer>false</isBaseLayer>
			<opacity>0.7</opacity>
			<isTransparent>true</isTransparent>
			<isVisible>false</isVisible>
			<minResolution>13.44</minResolution>
			<maxResolution>26.88</maxResolution>
			<layers>top50raster</layers>
			<format>image/png</format>
			<featureInfoFormat>application/vnd.ogc.gml</featureInfoFormat>
			<isAlpha>true</isAlpha>
			<isSingleTile>true</isSingleTile>
		</wmsLayer>
	</context>
</contextCollection>