<?xml version="1.0" encoding="UTF-8"?>
<contextCollection xmlns="http://schemas.heron-mc.org/hmc/1.0"
                   xmlns:xsi="http://www.w3.org/2001/XMLSchema-instance"
                   xsi:schemaLocation="http://schemas.heron-mc.org/hmc/1.0 http://schemas.heron-mc.org/hmc/1.0/heron-map-context.xsd">

    <title>Thematische PDOK configuratie - Deze configuratie bevat alle services geordend per thema</title>
    <baseUrl>http://geodata.nationaalgeoregister.nl/</baseUrl>
    <projection>EPSG:28992</projection>
    <units>m</units>
    <resolutions>
        3440.640,1720.320, 860.160, 430.080, 215.040, 107.520, 53.760, 26.880, 13.440, 6.720, 3.360, 1.680, 0.840, 0.420, 0.210, 0.105, 0.0525
    </resolutions>
    <maxExtent>-285401.920,22598.080,595401.920,903401.920</maxExtent>
    <center>155000,463000</center>
    <xyPrecision>3</xyPrecision>
    <zoom>2</zoom>
    <allOverlays>true</allOverlays>

    <context>
        <url>tms/achtergrond</url>
    </context>

    <contextFolder>
        <isExpanded>true</isExpanded>
        <title>Adminstratieve eenheden</title>
        <context>
            <url>wms/bestuurlijkegrenzen</url>
        </context>
        <context>
            <url>wms/bevolkingskernen2008</url>
        </context>
        <context>
            <url>wms/wijkenenbuurten</url>
        </context>
    </contextFolder>

    <contextFolder>
        <isExpanded>true</isExpanded>
        <title>Infrastructuur</title>
        <context>
            <url>wms/nhi</url>
        </context>
        <context>
            <url>wms/nwb</url>
        </context>
        <context>
            <url>wms/vin</url>
        </context>
        <context>
            <url>wms/weggegevens</url>
        </context>
    </contextFolder>

    <contextFolder>
        <isExpanded>true</isExpanded>
        <title>Statistiek</title>
        <context>
            <url>wms/cbsvierkanten</url>
        </context>
    </contextFolder>

    <contextFolder>
        <isExpanded>true</isExpanded>
        <title>Landgebruik</title>
        <context>
            <url>wms/aan</url>
        </context>
        <context>
            <url>wms/bodemgebruik2008</url>
        </context>
        <context>
            <url>wms/cultgis</url>
        </context>
    </contextFolder>

    <contextFolder>
        <isExpanded>true</isExpanded>
        <title>Milieu</title>
        <context>
            <url>wms/beschermdenatuurmonumenten</url>
        </context>
        <context>
            <url>wms/nationaleparken</url>
        </context>
        <context>
            <url>wms/natura2000</url>
        </context>
        <context>
            <url>wms/nok</url>
        </context>
        <context>
            <url>wms/wetlands</url>
        </context>
    </contextFolder>

    <contextFolder>
        <isExpanded>true</isExpanded>
        <title>Toerisme</title>
        <context>
            <url>wms/fietsknooppuntennetwerk</url>
        </context>
        <context>
            <url>wms/lawroutes</url>
        </context>
        <context>
            <url>wms/streekpaden</url>
        </context>
    </contextFolder>

    <contextFolder>
        <isExpanded>true</isExpanded>
        <title>Topografie</title>
        <context>
            <url>wms/ahn</url>
        </context>
        <context>
            <url>wms/dtb</url>
        </context>
        <context>
            <url>wms/top10nl</url>
        </context>
        <context>
            <url>wms/top50vector</url>
        </context>
        <context>
            <url>wms/top50raster</url>
        </context>
        <context>
            <url>wms/top250raster</url>
        </context>
    </contextFolder>

</contextCollection>
